id,bid,user_id,用户昵称,微博正文,头条文章url,发布位置,艾特用户,话题,转发数,评论数,点赞数,发布时间,发布工具,微博图片url,微博视频url,retweet_id
4464964317763245,Irg19wzzD,5659214084,信阳网警巡查执法,请大量转发！信阳市疫情防控指挥部发部防控知识25条1.疫情就是命令，时间就是生命。紧急行动起来，切实把疫情防控作为当前的一项重大任务。抓好重点地区、重点部位、重点人群防控工作，加大排查筛检，强化传染源控制，切断传播途径，聚焦规范处置，做到早发现、早报告、早隔离、早治疗，努力把输入性疫情风险降到最低。2.新型冠状病毒感染的肺炎可防、可控。做好疫情防控工作，已经不是单纯的医疗卫生问题，而是关系全局的重大公共卫生问题，必须以对人民群众健康高度负责的态度，全力抓好疫情防控工作。要加强市场监管，全面禁止市场销售活禽。一律取消大型公众聚集性活动，暂时关闭公共娱乐场所。3.时值新春佳节，人员大范围密集流动，疫情防控形势严峻，为确保全市人民群众身体健康和生命安全，我们建议市民朋友在日常生活中做好个人防护。避免前往人员密集区，避免接触发热呼吸道感染的病人，春节期间尽量留在家中，减少走亲串友和聚餐聚会，出门时要佩戴口罩。要坚持勤洗手、勤通风，不信谣，不传谣。4.温馨提示：为扎实做好我市新型肺炎疫情防控工作，我们建议市民朋友养成良好生活习惯。加强锻炼，规律作息，保持室内空气流通。不要随地吐痰，打喷嚏、咳嗽时用纸巾或袖肘遮住口鼻。5.新型冠状病毒感染的肺炎可防、可控。为扎实做好我市新型肺炎疫情防控工作，我们建议市民朋友注意饮食安全。避免接触野生禽畜，不食用野生动物，肉、蛋类食物食用前要彻底煮熟。6.温馨提示：健健康康过大年。春节期间，请您密切关注自身健康。如果出现发热、咳嗽、气促、胸闷等症状，尤其是有接触过新型冠状病毒感染的肺炎病例史的，请及时就医，以免错过最佳治疗时机。要配合当地疾控部门做好密切接触人群的追踪和排查等工作。7.为做好新型冠状病毒感染的肺炎疫情防控工作，遏制疫情蔓延势头，确保广大市民生命安全和身体健康，我们倡议积极参与爱国卫生运动。主动开展环境清洁活动，搞好房前、屋后的公共卫生和室内卫生，掌握了解卫生健康知识。8.新型冠状病毒肺炎的潜伏期最长约为14天，病例存在人传人情况，参照SARS和MERS的防控经验判断，潜伏期可能无传染性。新型冠状病毒感染的肺炎可防、可控。让我们增强责任意识和防护意识，齐心协力，群防群控，共同打赢这一场防疫阻击攻坚战！9.坚持把人民群众生命安全和身体健康放在第一位，通力开展市民宣传教育，坚决遏制疫情蔓延势头。请正确佩戴口罩。医用外科口罩：可以阻挡70%的细菌如果去公共场所不与病人接触，佩戴医用外科口罩就足够。医用防护口罩（N95口罩）：可以阻挡95%的细菌，如果会接触病人则应选择这种。10.新型冠状病毒感染的肺炎临床表现有哪些？患者主要临床表现为发热、乏力，呼吸道症状以干咳为主，并逐渐出现呼吸困难，严重者表现为急性呼吸窘迫综合征、脓毒症休克、难以纠正的代谢性酸中毒和出凝血功能障碍。部分患者起病症状轻微，可无发热。多数患者为中轻症，预后良好，少数患者病情危重，甚至死亡。11.冠状病毒不耐高温。56℃的环境下30分钟即可灭活病毒此外，乙醚、75%的乙醇含氯的消毒剂，都可以有效地灭活病毒。要坚持勤洗手，还要正确洗手。洗手时应使用肥皂或含有酒精成分的手消毒剂。12.打喷嚏时要遮挡。可使用一次性纸巾或手帕遮掩口鼻，用完后将纸巾丢进有盖的垃圾桶，并及时洗手若没有纸巾和手帕。请用衣服的袖子遮盖口鼻穿着短袖时请抬起手臂，对着胳肢窝打。13.公众如何预防新型冠状病毒感染的肺炎？保持手卫生。咳嗽、饭前便后、接触或处理动物排泄物后，要用流水洗手，或者使用含酒精成分的免洗洗手液。保持室内空气的流通。避免到封闭、空气不流通的公众场所和人多集中地方，必要时请佩戴口罩。咳嗽和打喷嚏时使用纸巾或屈肘遮掩口鼻，防止飞沫传播。14.公众如何预防新型冠状病毒感染的肺炎？医院就诊或陪护就医时，一定要佩戴好合适的口罩。良好安全饮食习惯，处理生食和熟食的切菜板及刀具要分开，做饭时彻底煮熟肉类和蛋类。尽量避免在未加防护的情况下接触野生或养殖动物。15.近期从武汉回家后，可在2周内注意加强身体防护，关注自身身体状态。如果接到疾控部门通知，需要接受居家医学观察，不要恐慌，不要上班，不要随便外出，做好观察，定期接受随访。如果出现发热(腋下体温≥37.3℃)、咳嗽、气促等急性呼吸道感染早期临床症状，请及时到当地指定医疗机构进行排查、诊治。16.冠状病毒是自然界广泛存在的一类病毒，因形态类似王冠而得名。研究发现，冠状病毒可引起人和动物呼吸道、消化道和神经系统疾病。除本次新型冠状病毒外，已知感染人的冠状病毒还有6种。其中4种在人群中较为常见，致病性较低，一般仅引起类似普通感冒的轻微呼吸道症状；另外2种是我们熟知的SARS和MERS。17.什么是密切接触者？与病例共同居住、学习、工作或其他有密切接触的人员；诊疗、护理、探视病例时未采取有效防护措施的医护人员、家属或其他与病例有类似近距离接触的人员；病例同病室的其他患者及陪护人员；与病例乘坐同一交通工具并有近距离接触的人员；现场调查人员调查后经评估认为符合条件的人员。18.针对冠状病毒，公众应减少疾病的暴露和传播，如在流感流行季节尽量少去人群密集的地方、出门戴口罩、饭前便后洗手等，并在可能的情况下避免与有呼吸道疾病症状(例如咳嗽或打喷嚏)的人密切接触。19.去医院就医需要注意什么？就医时，应如实详细讲述患病情况和就医过程，尤其应告知医生近期的武汉旅行和居住史、与肺炎患者或疑似患者的接触史、动物接触史等。特别应注意的是，诊疗过程中应全程佩戴外科口罩，以保护自己和他人。20.钟南山：新型冠状病毒跟SARS病毒相比，尽管有很多的同源性，但是是平行的，完全不同的病毒，只是某些方面有近似的地方。新型冠状病毒的感染正在爬坡，但是相比SARS传染性没那么强。21.报国务院批准同意，国家卫健委将新型冠状病毒感染的肺炎纳入法定传染病乙类管理，采取甲类传染病的预防、控制措施。各级人民政府、卫生健康行政部门、其他政府部门、医疗卫生机构可以依法采取病人隔离治疗、密切接触者隔离医学观察等系列防控措施，共同预防控制新型冠状病毒感染的肺炎疫情的传播。22.科学预防，不信谣不传谣！喝双黄连抗病毒口服液和板蓝根，能预防新型冠状病毒感染的肺炎？放烟花爆竹形成的二氧化硫能杀灭病毒？吸烟的人不易被病毒感染，因为烟雾在肺表面形成一层保护膜？在家用铁锅熬白醋能熏死空气中的病毒？预防新型冠状病毒，这些都是谣言！23.戴口罩前要把手洗干净，把鼻子、口、下巴罩好，将金属片夹紧鼻梁，防止出现缝隙；尽量不要用手触碰口罩内面。当口罩被鼻涕污染后就应立即更换，一次性口罩佩戴4小时后就要丢弃，不要重复使用。从医院出来后应将口罩丢弃到医疗废弃物垃圾袋（黄色）中；从外面回家在摘除口罩后，一定要进行手卫生消毒。24.新型冠状病毒的易感人群有哪些？所有人都易感，老年人、免疫功能比较低下的、有慢性病的这些人，更容易感染，或者变重症。目前，针对新型冠状病毒感染的肺炎患者无特效抗病毒药物，治疗主要是对症治疗。给患者一定的营养，一定的休息，对症治疗为主。25.七字洗手口诀“内-外-夹-弓-大-立-腕”要牢记：餐前便后、外出回家、接触垃圾、抚摸动物后要洗手。用流动的水和使用肥皂（皂液）洗手，揉搓的时间不少于15秒。首先流水湿手，涂抹洗手液或者肥皂。一洗手掌；二洗背侧指缝；三洗掌侧指缝；四洗指背；五洗拇指；六洗指尖；七洗手腕、手臂。,,,,,2,0,1,2020-01-26 12:45,360安全浏览器,,,
4464963722735118,Irg0cbtwO,2868605820,ETeacher_coco吴,中医预防疫病要领北京中医药大学教授主任医师李刘坤1、未病先防：中医強调治未病胜于治已病。因此，若有疫病密切接触或有发病征兆者，可及时服用一些驱邪解毒方药，如连花清瘟胶囊、银黄颗粒、板蓝根颗粒、双黄连口服液等。2、固护正气：中医认为邪不能独伤人，邪之所凑，其气必虚，正气存内，邪不可干，故预防疫病，平时固护正气，最为重要。固护正气，须从多方面入手，包括饮食合理，起居有时，劳逸适度，精神调养，锻炼强身等多方面，且须持之以恒，方能见功。3、驱避邪毒：中医強调虚邪贼风，疫毒疠气，及时驱避。内容包括搞好个人及环境卫生，注意个人防护、病人隔离、病源动物处理等。,,,,,4,0,3,2020-01-26 12:42,HUAWEI P30 Pro,,,
4464960295462750,IrfUFmV6S,3476622610,達奇鴨,新浪财经全球市场7*24小时直播【黑龙江：千万元药品运往武汉！】1月23日，黑龙江省红十字会向湖北省红十字会捐赠价值1000万元的药品，药品由哈药集团有限公司提供，包括三精牌双黄连口服液、世一堂牌复方金银花颗粒、“护彤”牌小儿氨酚黄那敏颗粒等，均为具有广谱抗病毒治疗或O网页链接,,,,,0,0,0,2020-01-26 12:29,新浪财经,,,
4464956785698573,IrfP0nUst,5084136996,华盛7x24,【黑龙江：千万元药品运往武汉！】1月23日，黑龙江省红十字会向湖北省红十字会捐赠价值1000万元的药品，药品由哈药集团有限公司提供，包括三精牌双黄连口服液、世一堂牌复方金银花颗粒、“护彤”牌小儿氨酚黄那敏颗粒等，均为具有广谱抗病毒治疗或预防作用的产品。该批药品已经通过湖北省红十字咨询当地卫生部门同意接收，并将通过九州通医药集团的绿色配送渠道运抵湖北武汉。（央视）九州通sh600998,,,,,0,0,0,2020-01-26 12:15,华盛通,,,
4464956752021033,IrfOX8tLj,5506906732,嗨牛财经,实时播报：【黑龙江：千万元药品运往武汉！】1月23日，黑龙江省红十字会向湖北省红十字会捐赠价值1000万元的药品，药品由哈药集团有限公司提供，包括三精牌双黄连口服液、世一堂牌复方金银花颗粒、“护彤”牌小儿氨酚黄那敏颗粒等，均为具有广谱抗病毒治疗或预防作用的产品。该批药品已经通过湖北省红十字咨询当地卫生部门同意接收，并将通过九州通医药集团的绿色配送渠道运抵湖北武汉。（央视）,,,,,0,0,2,2020-01-26 12:15,专业版微博,,,
4464956508895674,IrfOyBkaC,6259394869,嗨牛财经直播君,实时播报：【黑龙江：千万元药品运往武汉！】1月23日，黑龙江省红十字会向湖北省红十字会捐赠价值1000万元的药品，药品由哈药集团有限公司提供，包括三精牌双黄连口服液、世一堂牌复方金银花颗粒、“护彤”牌小儿氨酚黄那敏颗粒等，均为具有广谱抗病毒治疗或预防作用的产品。该批药品已经通过湖北省红十字咨询当地卫生部门同意接收，并将通过九州通医药集团的绿色配送渠道运抵湖北武汉。（央视）,,,,,0,0,0,2020-01-26 12:14,微博 weibo.com,,,
4464956487463146,IrfOwvjvk,5051077448,快兰斯24小时财经直播,实时播报：【黑龙江：千万元药品运往武汉！】1月23日，黑龙江省红十字会向湖北省红十字会捐赠价值1000万元的药品，药品由哈药集团有限公司提供，包括三精牌双黄连口服液、世一堂牌复方金银花颗粒、“护彤”牌小儿氨酚黄那敏颗粒等，均为具有广谱抗病毒治疗或预防作用的产品。该批药品已经通过湖北省红十字咨询当地卫生部门同意接收，并将通过九州通医药集团的绿色配送渠道运抵湖北武汉。（CCTV）,,,,,7,12,45,2020-01-26 12:14,微博Win8客户端,,,
4464940712792716,Irfp5bIvO,6563097047,WAITINGFOR46447,我14号从新疆到湖南，途径湖北，在火车上，咽喉干涩，到家后，喉咙嘶哑，咽喉疼，以为是咽炎，吃双黄连和咽炎片本以为好转，但去了老家又开始严重，开始穿棉裤保暖，同时逐渐咳嗽，发低热，肌肉酸痛无力，炎症较重，稍微行动头痛。随后，吃退烧药，喝我老爸熬制的中药和阿莫西林逐渐好转，现在已经好了。症状主要从咽部开始，干涩，到肿痛，到嘶哑，开始发热，咳嗽，肺部紧张。因为我整个过程在早于新型冠状病毒被确诊前，加上爸爸是医生，也没有持续发热现场，所以没有去医院诊断是否是阳性，但后面发现不一定会发烧所以还是有些担心。持续时间为16号至24号。从大二开始，我每年从新疆回湖南均会发热或感冒。今年尤为严重，我清楚的感觉到今年是由呼吸道所引起的，很有可能和空气质量变化有关。,,,,,0,2,1,2020-01-26 11:11,OPPO随光而变R17,,,
4464934710764587,Irffp3cU3,1792799924,都是你哒-,边吃薯片边喝双黄连，和妈妈一起看囧妈，徐峥导演的魄力真的佩服。在家里闷坏了，赶紧买了椭圆机加强运动，提高免疫力💪,,,,,0,0,0,2020-01-26 10:47,iPhone客户端,"['http://ww4.sinaimg.cn/large/6adbf4b4ly1gb9rquhuy7j20tu0tutz4.jpg', 'http://ww4.sinaimg.cn/large/6adbf4b4ly1gb9rqwg16jj213u0tue81.jpg']",,
4464922434184857,IreVBhyFH,7331240230,用户7331240230,肺炎来了。家里备用药双黄连,,,,,0,0,0,2020-01-26 09:58,微博 HTML5 版,,,
4464918386954874,IreP4tbho,1899189115,佳么斯鹅,个人预防肺炎几点看法：一：注意保暖，预防感冒，无论普通感冒还是普通流感，都要注意。一旦感冒，抓紧控制。二：家中自备抗病毒感冒药：感康效果不错，以及双黄连口服液，阿莫西林、左氧氟沙星消炎药，橘红颗粒，莲花清瘟胶囊。三：一出现感冒症状，立即口服感冒药和消炎药，并卧床休息，大量喝开水。饮食清淡，减少鱼肉蛋等。有明显发热可加服双黄连口服液。如果有几种口服药，最好间隔服用。如有氧饱和指夹监测，可看氧饱和情况。如出现呼吸急促和困难，就要抓紧去医院。肺不好的人，比如支气管炎、肺气肿，最怕感冒。目前肺炎的病理学复杂，自我多想办法去有效预防控制，肯定比硬挺着强。大役当前，每个人都做好自己，整个大环境自然就都好了。,,,,,0,11,8,2020-01-26 09:42,小米8 SE,['http://ww3.sinaimg.cn/large/7133537bgy1gb9pkww7chj20qy14k0uw.jpg'],,
4464806255876985,IrbUdoES5,6173354214,PP的成长手册,1月22日晚上去人民医院挂了儿科，这边的人们防护也都做的很好，都带了口罩，我们把自己捂着严严实实的进了医院，花了2个多小时，看病抽血化验，最后医生开了整肠生和双黄连口服液，问医生需要吃头孢吗，医生居然说不用，在我们看来娃都要不行的病（娃从下午一直昏睡到晚上，就抽血的时候醒了一下，也没有吃东西）医生轻描淡写的就把我们打发了。回家10点多看完病回到奶奶家摇起娃让他吃了就又睡了过去！第二天被手机信息声吵醒，武汉居然封城了……好吧，我们只能全部自我隔离家里蹲了，但是奇迹般地吃了医生的娃，恢复了2天娃又生龙活虎起来！后面是最近在家的视频在家只能自娱自乐和几个妈视频玩啦,,,,,0,0,3,2020-01-26 02:17,iPhone客户端,"['http://ww3.sinaimg.cn/large/006JMLrggy1gb9cvlymd2j32c0340qv6.jpg', 'http://ww4.sinaimg.cn/large/006JMLrggy1gb9cvmjy7jj30pb18zn4u.jpg', 'http://ww4.sinaimg.cn/large/006JMLrggy1gb9cvoste4j33402c07wi.jpg', 'http://ww1.sinaimg.cn/large/006JMLrggy1gb9cvqpyfuj30u01hc7f4.jpg', 'http://ww3.sinaimg.cn/large/006JMLrggy1gb9ctba7ikj30n01dskjn.jpg', 'http://ww1.sinaimg.cn/large/006JMLrggy1gb9ctdczypj30n01dsx6p.jpg', 'http://ww4.sinaimg.cn/large/006JMLrggy1gb9ct8wpavj30n01dsnpe.jpg', 'http://ww3.sinaimg.cn/large/006JMLrggy1gb9cteokpwj30n01dsqv5.jpg', 'http://ww4.sinaimg.cn/large/006JMLrggy1gb9cvj6m2nj30t61fun8b.jpg']",,
4464772957812733,Irb2vwMrP,5685239702,陆一Simon,虽然我慌，但是，我忍不住想笑，真不敢招惹蛇黄鼠狼大仙，吃的野味也就是年年春天的双黄连，婆婆丁，还有树下的野蘑菇😂，够野嘛,,,,,0,0,1,2020-01-26 00:04,OPPO Reno 10倍变焦版,,,
4464772101794881,Irb187wVH,6325138856,花生酥不酥不如凤梨酥,莓莓榛棒脑回路很长的我现在才品到这是在夸我欸那我肯定棒希望咳嗽快快好我也想喝超大杯的咖啡而不是超小杯的双黄连哥哥姐姐姐夫今天都离开家准备回到自己的岗位上他们轻描淡写云淡风轻那就默默给他们加油,,,,,0,7,1,2020-01-26 00:01,🌻的iPhone XS,"['http://ww2.sinaimg.cn/large/006U3DyEgy1gb982isfibj33402c0kjm.jpg', 'http://ww2.sinaimg.cn/large/006U3DyEgy1gb982qiig9j316o16mx1f.jpg', 'http://ww4.sinaimg.cn/large/006U3DyEgy1gb98250vsqj31o01o04qq.jpg', 'http://ww2.sinaimg.cn/large/006U3DyEgy1gb980l68oyj33402c07wi.jpg', 'http://ww4.sinaimg.cn/large/006U3DyEgy1gb980tdq7qj33402c0kjm.jpg', 'http://ww2.sinaimg.cn/large/006U3DyEgy1gb98125efvj33402c0qv6.jpg', 'http://ww3.sinaimg.cn/large/006U3DyEgy1gb981bvxpzj33402c0npe.jpg', 'http://ww4.sinaimg.cn/large/006U3DyEgy1gb981q5cdmj30v910htci.jpg', 'http://ww4.sinaimg.cn/large/006U3DyEgy1gb981p56x5j33402c07wj.jpg']",,
4464765281597121,IraQ86Hu1,5590865221,他喝多总笑,中午板蓝根晚上双黄连预防病毒🦠从我做起,,,,,0,1,6,2020-01-25 23:34,iPhone,['http://ww4.sinaimg.cn/large/0066mHrvly1gb98aqhrguj32c02c0b29.jpg'],,
4464760760045293,IraIQ0bMx,6665609179,奥莉小甜熙熙熙,每天朋友圈刷到肺炎相关，焦虑了就京东淘宝买消毒液酒精洗手液口罩，今天还下单了双黄连黄芪精抗病毒口服液，可惜一个没到，下单了心理上也好过点。,,,,,0,0,0,2020-01-25 23:16,罗云熙的罗狮粉,,,
4464759397188775,IraGDua7Z,3256171211,coolgirlisme,新年第一天！我们真时刻响应国家号召了自觉集体双黄连+量体温+戴口罩（二磊除了吃饭时刻戴口罩）咱也不知道有没有用,,哈尔滨,,,0,0,2,2020-01-25 23:10,iPhone客户端,"['http://ww1.sinaimg.cn/large/c2153acbly1gb96rbi4y7j22c0340qv5.jpg', 'http://ww4.sinaimg.cn/large/c2153acbly1gb96rckeitj22801o0qv5.jpg', 'http://ww4.sinaimg.cn/large/c2153acbly1gb96rdcdnpj23402c0qv5.jpg', 'http://ww1.sinaimg.cn/large/c2153acbly1gb96rhi8r4j24tc37kkjo.jpg', 'http://ww2.sinaimg.cn/large/c2153acbly1gb96rffgamj24tc37kqv8.jpg', 'http://ww3.sinaimg.cn/large/c2153acbly1gb96rjazx4j237k4tc1l0.jpg', 'http://ww2.sinaimg.cn/large/c2153acbly1gb96rk91stj22801o0x6p.jpg', 'http://ww4.sinaimg.cn/large/c2153acbly1gb96rm1ow2j24tc37knph.jpg', 'http://ww1.sinaimg.cn/large/c2153acbly1gb96sd7x2fj21o02807wh.jpg']",,
4464739168340365,Iraa0yZI1,1625993875,番茄Echo,#春节好#正月初一🏮D4:昨晚上不知道是不是瓜子儿嗑多了，睡前嗓子疼得很，吓得我赶紧量量体温喝下一瓶双黄连。今天基本是躺着废宅的一天，陪妈妈打了会牌,,,,春节好,0,0,0,2020-01-25 21:50,iPhone客户端,['http://ww2.sinaimg.cn/large/60eab293ly1gb95blskeoj23402c07wk.jpg'],,
4464738622774178,Ira98bDGO,5271910094,何处寻笛声,以前的饮料：奶茶，咖啡，可乐。。。。。现在的饮料：999，双黄连，泡腾片。。。。。,,,,,0,0,1,2020-01-25 21:48,陈伟霆的女皇,,,
4464729877470459,Ir9V1vlph,5713300413,周杰伦手中的奶茶,#封城日记#黄石封城第二天没有出门小区基本没有人走动真的每天在家吃了睡睡了吃每天消毒液稀释拖地每天洗八百遍手后悔没有多备一点双黄连现在每天刷微博真的心慌慌看的症状总喜欢往自己身上搬真的中国能慢慢控制病毒医务人员平平安安,,,,封城日记,0,0,3,2020-01-25 21:13,iPhone客户端,['http://ww3.sinaimg.cn/large/006eEqqFly1gb945uki81j31be0qok0p.jpg'],,
4464722818997463,Ir9JDBKEn,7229591826,多多米妮,#对症和中药治愈北京2例新型肺炎患者#看到肺炎被中医治愈本来很开心，点开热搜怎么那么多瞧不起中医的人，当年非典中医的功劳是被忘了吗？青蒿素难道不是从中药中提取出来的吗？你们平常喝的板蓝根，抗病毒口服液，三九感冒灵，双黄连口服液，三黄片这些中成药难道都与中医无关吗？我亲眼见过中医治疗过一些疑难杂症的，难道都是巧合吗？中医本身是强大的，只不过被一些不懂中医的“中医”把中医的名声毁了。都是治病救人的，没什么高低贵贱吧,,,,对症和中药治愈北京2例新型肺炎患者,0,0,0,2020-01-25 20:45,vivo智能手机,,,
4464720561814776,Ir9G07C6A,2604491344,不能放弃奶昔的某溪,#对症和中药治愈北京2例新型肺炎患者#挺不明白黑中医中药的，平时感冒是不是连三九双黄连之类的也不喝吗？全靠化学符号能写出来的药治疗？问起蒲地蓝来大夫说这是糟践中药，注射液提纯不行但口服完全没问题。,,,,对症和中药治愈北京2例新型肺炎患者,0,3,10,2020-01-25 20:36,nova4自拍极点全面屏,,,
4464718272493894,Ir9CjasM6,6257166877,淮安洪福,大连新鲜事【药企捐赠大批物资抗击疫情】新型肺炎疫情牵动人心，近日大批药企积极行动，捐赠药品物资送往疫情前线。日前，修正集团决定向武汉疫区捐赠第一批价值1000万元的药品；哈药集团向武汉捐赠价值千万元的三精双黄连等药品 ；人福医药向武汉捐赠价值千万元的呼吸机和药品；辉瑞中国向武汉相关医疗机构捐赠价值220万元的抗感染产品；罗氏制药与罗氏诊断共同通过中国人口福利基金会紧急捐赠总额超过430万元现金和物资；拜耳也紧急调配了拜复乐针剂及片剂送至武汉。（记者张尼）,,,,,1,0,0,2020-01-25 20:27,大连新鲜事超话,['http://ww3.sinaimg.cn/large/006PsqWply1gb92x77rquj308c08cwf2.jpg'],,
4464714903455100,Ir9wSeuPq,6072764820,武汉同城,#众志成城武汉能#【药企捐赠大批物资抗击疫情】#湖北加油#日前，修正集团决定向武汉疫区捐赠第一批价值1000万元的药品；哈药集团向武汉捐赠价值千万元的三精双黄连等药品；人福医药向武汉捐赠价值千万元的呼吸机和药品；辉瑞中国向武汉相关医疗机构捐赠价值220万元的抗感染产品；罗氏制药与罗氏诊断共同通过中国人口福利基金会紧急捐赠总额超过430万元现金和物资；拜耳也紧急调配了拜复乐针剂及片剂送至武汉。,,,,"众志成城武汉能,湖北加油",3,10,35,2020-01-25 20:14,微博 weibo.com,"['http://ww2.sinaimg.cn/large/7a273328gy1gb91c3cu6cj20v91vo1kx.jpg', 'http://ww2.sinaimg.cn/large/7a273328gy1gb91c34hc9j20ku0xcdp3.jpg']",,
4464706448460430,Ir9jezuWy,2889676560,沉鹿鸣笙,啊……双黄连口服液，刺激到我发炎的喉咙了！,,,,,0,0,0,2020-01-25 19:40,前置双摄vivo X9Plus,,,
4464704522839873,Ir9g8bUMp,3604378011,中国新闻社,【#药企捐赠大批物资抗击疫情#】新型肺炎疫情牵动人心，近日大批药企积极行动，捐赠药品物资送往疫情前线。日前，修正集团决定向武汉疫区捐赠第一批价值1000万元的药品；哈药集团向武汉捐赠价值千万元的三精双黄连等药品 ；人福医药向武汉捐赠价值千万元的呼吸机和药品；辉瑞中国向武汉相关医疗机构捐赠价值220万元的抗感染产品；罗氏制药与罗氏诊断共同通过中国人口福利基金会紧急捐赠总额超过430万元现金和物资；拜耳也紧急调配了拜复乐针剂及片剂送至武汉。（记者张尼）,,,,药企捐赠大批物资抗击疫情,4,5,31,2020-01-25 19:32,微博 weibo.com,['http://ww3.sinaimg.cn/large/d6d6719bly1gb91bj3fd4j20jg0elgmp.jpg'],,
