id,bid,user_id,用户昵称,微博正文,头条文章url,发布位置,艾特用户,话题,转发数,评论数,点赞数,发布时间,发布工具,微博图片url,微博视频url,retweet_id
4644652551241809,KiJCf5d3b,1932560435,头条正能量,不要看不起任何人，有时候救你命的，就是那些不起眼的普通人！甘肃白银市景泰县常生村村民，放羊大叔朱克铭，当时不顾寒风冰雹，救助参加马拉松越野赛，遭遇低温失能的选手六人，拯救了六个家庭，功德无量，真正感动中国的中国好人！,,,,,0,0,0,2021-06-05 09:02,即刻笔记,['http://ww4.sinaimg.cn/large/7080ab5bly1gqyaijtxycj20eh0lxdjm.jpg'],,
4644642417804654,KiJlTwKlw,7561720155,安梦电影圈,#马拉松罹难者梁晶末了一条抖音#白银马拉松越野赛名将梁晶罹难，末了一条同伙圈：风有点大#本日热点#L艺人MV的微博视频,,,,"马拉松罹难者梁晶末了一条抖音,本日热点",0,0,0,2021-06-05 08:21,微博视频号,,"http://f.video.weibocdn.com/003wRmwVgx07Nd6tA7hK010412001JNs0E010.mp4?label=mp4_ld&template=360x640.24.0&trans_finger=81b11b8c5ffb62d33ceb3244bdd17e7b&ori=0&ps=1BVp4ysnknHVZu&Expires=1624595575&ssig=ErVUWWktOk&KID=unistore,video",
4644639732927080,KiJhzchsY,1828507015,郴州联通,郴州联通发布【#体育总局暂停山地越野等高危体育赛事#】据国家体育总局，5月22日，甘肃省白银市黄河石林百公里越野赛因局部天气突变发生公共安全事件，造成重大人员伤亡，教训十分沉痛。为切实保障人民群众身体健康和生命安全，从即日起，暂停山地越野、戈壁穿越、翼装飞行、超长距离跑等管理责任不清、规则不完善、安全防护标准不明确的新兴高危体育赛事活动。@人民日报,,,人民日报,体育总局暂停山地越野等高危体育赛事,2,0,2,2021-06-05 08:11,HUAWEI Mate30 Pro 5G,['http://ww3.sinaimg.cn/large/6cfccd87gy1gr72m7x95mj20yn0lt7bg.jpg'],,
4644611203531363,KiIxyeOFt,5403137725,我是一片云37725,《GQ报道》做了一篇伟大的报道，名为《这里是白银越野赛全部21位逝者的故事》。张凤莲的故事被放在第一位。她在5月22日白银越野马拉松赛事中去世时，年仅50岁，各种跑步赛事的比赛奖金，是张凤莲一家四口收入的重要来源。张凤莲曾经是甘肃省人民医院的医生，28岁的时候，嫁给了比自己年长17岁的丈夫陈发海。42岁，张凤莲怀上了二胎，为了生这个二胎，她失去了在医院的工作。一位连25块钱的运动鞋都不舍得穿的女性，一位因为超生失去医生工作的女性，一位用命去跑、去养家的女性。O甘肃山地马拉松事故21人遇难者的故事,,,,,0,0,0,2021-06-05 06:17,荣耀V9 我想要的快,,,
4644576544948963,KiHDEkLrZ,2636800150,凤凰FM电台,#今日早报##早间分享#【体育总局暂停山地越野赛事；警惕涉新冠疫苗骗局】5月22日，甘肃省白银市黄河石林百公里越野赛因局部天气突变发生公共安全事件，造成重大人员伤亡，教训十分沉痛。为切实保障人民群众身体健康和生命安全，从即日起，暂停山地越野、戈壁穿越、翼装飞行、超长距离跑等管理责任不清、规则不完善、安全防护标准不明确的新兴高危体育赛事活动。体育总局将对体育赛事活动进行全面梳理，加快完善管理制度，健全标准规范，全面加强对体育赛事活动安全的管理保障。近期有人反映，接到自称是“疫苗接种普查调查员”的好友申请。对此，警方提醒，这是虚假信息，遇到请直接删除、拉黑！此外，涉新冠疫苗的主要骗局还有引诱性链接、社交群交费、陌生号码来电。这是典型的冒充公检法诈骗，骗子冒用疫情防控中心、卫健委致电受害人，再以各种名头给受害人扣上“涉嫌新冠疫苗违法犯罪”的帽子。然后，主动将受害人的电话转接至“公安局”，其实只是骗子互通内线的戏码。最终，对方会以“清查资金”诱导受害人转账。L凤凰FM电台的微博视频,,,,"今日早报,早间分享",0,0,1,2021-06-05 04:00,微博视频号,,"http://f.video.weibocdn.com/9uAXfXhElx07NcmY0Gus010412016KPm0E010.mp4?label=mp4_ld&template=640x360.25.0&trans_finger=40a32e8439c5409a63ccf853562a60ef&ori=0&ps=1BVp4ysnknHVZu&Expires=1624595575&ssig=5IT0ENFk8t&KID=unistore,video",
