id,bid,user_id,用户昵称,微博正文,头条文章url,发布位置,艾特用户,话题,转发数,评论数,点赞数,发布时间,发布工具,微博图片url,微博视频url,retweet_id
4644010918416698,KisVlzjzc,7561720155,安梦电影圈,#甘肃马拉松变乱一半家族签补偿和谈#甘肃白银山地越野赛后续：一半以上罹难职员家族杀青补偿和谈#本日热点#L艺人MV的微博视频,,,,"甘肃马拉松变乱一半家族签补偿和谈,本日热点",0,0,0,2021-06-03 14:32,微博视频号,,"http://f.video.weibocdn.com/002O9GAegx07Nak9bws001041200exGj0E010.mp4?label=mp4_ld&template=640x360.25.0&trans_finger=40a32e8439c5409a63ccf853562a60ef&ori=0&ps=1BVp4ysnknHVZu&Expires=1624595114&ssig=xZ%2B6DLra9J&KID=unistore,video",
4644010817226434,KisVbujVo,1842106923,爱锦州官方微博,爱锦州【体育总局：暂停山地越野、戈壁穿越等新兴高危体育赛事活动】#体育总局暂停山地越野等赛事#体育总局网站6月2日消息，体育总局办公厅印发通知：5月22日，甘肃省白银市黄河石林百公里越野赛因局部天气突变发生公共安全事件，造成重大人员伤亡，教训十分沉痛。为切实保障人民群众身体健康和生命安全，从即日起，暂停山地越野、戈壁穿越、翼装飞行、超长距离跑等管理责任不清、规则不完善、安全防护标准不明确的新兴高危体育赛事活动。体育总局将对体育赛事活动进行全面梳理，加快完善管理制度，健全标准规范，全面加强对体育赛事活动安全的管理保障。各地要严格落实非必要不办赛要求，坚持底线思维，增强风险意识，强化属地管理责任，采取切实有效措施防范和化解风险。要围绕组织运营、服务保障、安全管理、应急救援、疫情防控、地质条件、气象因素等内容，对所有赛事活动开展全面风险排查，存在安全隐患的一律暂停，严防体育领域安全事件发生，为迎接建党100周年营造良好的环境和氛围。#为什么要伤害玩摩尔庄园的小朋友##延长产假至3年能提高生育率吗##怎么判断面试是不是凉了##追随象群拍吃播是什么心态##三孩政策会带来哪些改变##有一个无语的哥哥是啥体验##28岁该不该凑合结婚##全面两孩政策后为啥出生人口仍有下降#（全媒体编辑：李怡芳来源：中国新闻网）,,,,"体育总局暂停山地越野等赛事,为什么要伤害玩摩尔庄园的小朋友,延长产假至3年能提高生育率吗,怎么判断面试是不是凉了,追随象群拍吃播是什么心态,三孩政策会带来哪些改变,有一个无语的哥哥是啥体验,28岁该不该凑合结婚,全面两孩政策后为啥出生人口仍有下降",0,0,0,2021-06-03 14:32,微博 weibo.com,['http://ww3.sinaimg.cn/large/6dcc522bly1gr4asn41cfj20c806vzkl.jpg'],,
4643998348612763,KisB4A8zx,7054753339,极限时间XGame,这些赛事活动被体育总局叫停！-极限时间:5月22日，甘肃省白银市黄河石林百公里越野赛因局部天气突变发生公共安全事件，造成重大人员伤亡。6月2日，国家体育总局办公厅发布关于暂停相关体育活动的通知：O网页链接,,,,,0,0,0,2021-06-03 13:42,极限时间,['http://ww4.sinaimg.cn/large/007Hr1Cbly8gr50ye57bej30rj0i840y.jpg'],,
4643997982658510,KisAub9Bc,5587382201,临沂日报,【高危！即日起，暂停！】体育总局办公厅发布关于暂停相关体育活动的通知↓↓↓国家体育总局2日表示，5月22日，甘肃省白银市黄河石林百公里越野赛因局部天气突变发生公共安全事件，造成重大人员伤亡，教训十分沉痛。为切实保障人民群众身体健康和生命安全，从即日起，暂停山地越野、戈壁穿越、翼装飞行、超长距离跑等管理责任不清、规则不完善、安全防护标准不明确的新兴高危体育赛事活动。体育总局将对体育赛事活动进行全面梳理，加快完善管理制度，健全标准规范，全面加强对体育赛事活动安全的管理保障。国家体育总局强调，各地要严格落实非必要不办赛要求，坚持底线思维，增强风险意识，强化属地管理责任，采取切实有效措施防范和化解风险。要围绕组织运营、服务保障、安全管理、应急救援、疫情防控、地质条件、气象因素等内容，对所有赛事活动开展全面风险排查，存在安全隐患的一律暂停，严防体育领域安全事件发生，为迎接建党100周年营造良好的环境和氛围。,,,,,0,0,0,2021-06-03 13:41,微博 weibo.com,,,
4643995734770770,KiswRk15U,7046706509,四川省崇州监狱,【国家体育总局：#山地越野等赛事被暂停#】国家体育总局：5月22日，甘肃白银市黄河石林百公里越野赛因局部天气突变发生公共安全事件，造成重大人员伤亡。为切实保障人民群众身体健康和生命安全，从即日起，暂停山地越野、戈壁穿越、翼装飞行、超长距离跑等管理责任不清、规则不完善、安全防护标准不明确的新兴高危体育赛事活动。#张警官说狱事儿##张警官分享#@四川监狱@法治四川,,,"四川监狱,法治四川","山地越野等赛事被暂停,张警官说狱事儿,张警官分享",0,0,0,2021-06-03 13:32,微博 weibo.com,,,
4643987292425713,Kisjfab2p,1202586970,毽客逆风飞扬,#毽客视线#8年前张F莲因为生二胎被自己的工作单位甘省人民医院开除，从小康之家坠入困顿，靠卖菜为生，后来发现跑步可以挣奖金，就去跑步，比赛奖金是一家四口收入的重要来源。只有一双跑步鞋，最终在白银百公里赛遇难了......几天后他们说“可以生三胎”了。如果不是这次意外，外界很多人都不知道有梁晶这样一群“以跑为生”的“赏金猎人”。“赏金猎人”泛指那些通过完成高难度任务来获取高额赏金的传奇人物。不过，越野赛道上的这些“赏金猎人”，获得的赏金并不高(梁晶半月跑3场奖金2万)。#体育总局暂停山地越野等赛事##三孩政策会带来哪些改变#L毽客逆风飞扬的微博视频,,,,"毽客视线,体育总局暂停山地越野等赛事,三孩政策会带来哪些改变",14,28,110,2021-06-03 12:58,微博视频号,,"http://f.video.weibocdn.com/xZgr5Bhilx07NadHthu001041200mNnz0E010.mp4?label=mp4_ld&template=360x636.24.0&trans_finger=81b11b8c5ffb62d33ceb3244bdd17e7b&ori=0&ps=1BVp4ysnknHVZu&Expires=1624595114&ssig=yqMAUvVutS&KID=unistore,video",
4643985639346198,KisgzDdn8,3811559344,昆明防震,【#体育总局暂停山地越野等高危体育赛事#】据国家体育总局，5月22日，甘肃省白银市黄河石林百公里越野赛因局部天气突变发生公共安全事件，造成重大人员伤亡，教训十分沉痛。为切实保障人民群众身体健康和生命安全，从即日起，暂停山地越野、戈壁穿越、翼装飞行、超长距离跑等管理责任不清、规则不完善、安全防护标准不明确的新兴高危体育赛事活动。,,,,体育总局暂停山地越野等高危体育赛事,0,0,3,2021-06-03 12:52,小米10,['http://ww2.sinaimg.cn/large/e32fc7b0ly1gr4zhtw6u2j20yn0lt7bg.jpg'],,
4643980979476224,Kis93DLck,6501780549,岁月神偷xibei2003,今天，培训班有一堂课，观看有教育意义的电影《悬崖之上》，革命志士不畏牺牲的坚定信念令人敬畏。晚饭后，在公寓门卫室与两个保安聊天，他们分别来自山东和四川，已经在疆多年，很实在的两个人，他们说自己的工资太低了，但仍能够安于现状。晚上休息前，又看了一遍大学校友转发的那篇关于白银百公里越野赛21位逝者的故事，这是悲伤弥漫的痛，这是真实的悲剧，愿逝者得以安息，愿我们活着的每一个人坚强、有尊严、好运！(2/6周三),,,,,0,0,3,2021-06-03 12:33,vivo X27,,,
4643971764589956,KirUcjg3y,1155549130,_sugertea_,//@虾米匆匆:转发不是说完全认同原po观点，GQ的那篇白银越野赛相关报道（O网页链接）确实有点问题，太重煽情而用力过猛，信源单一，加上张凤莲经历撞上热点又有信息噪点，引发广泛质疑正常。但就像有人说的，质疑可以，但不要定罪。生活有时候比小说更加荒诞而不讲理,,,虾米匆匆,,0,0,0,2021-06-03 11:56,廷廷❤iPhone客户端,,,4643703760618073
4643970850227849,KirSJ0XgZ,3077322920,ZUZO_MEDIA,攀枝花身边事#体育总局暂停山地越野等赛事#6月2日，国家体育总局办公厅发布了关于暂停相关体育活动的通知。各省、自治区、直辖市人民政府办公厅，新疆生产建设兵团办公厅：5月22日，甘肃省白银市黄河石林百公里越野赛因局部天气突变发生公共安全事件，造成重大人员伤亡，教训十分沉痛。为切实保障人民群众身体健康和生命安全，从即日起，暂停山地越野、戈壁穿越、翼装飞行、超长距离跑等管理责任不清、规则不完善、安全防护标准不明确的新兴高危体育赛事活动。体育总局将对体育赛事活动进行全面梳理，加快完善管理制度，健全标准规范，全面加强对体育赛事活动安全的管理保障。各地要严格落实非必要不办赛要求，坚持底线思维，增强风险意识，强化属地管理责任，采取切实有效措施防范和化解风险。要围绕组织运营、服务保障、安全管理、应急救援、疫情防控、地质条件、气象因素等内容，对所有赛事活动开展全面风险排查，存在安全隐患的一律暂停，严防体育领域安全事件发生，为迎接建党100周年营造良好的环境和氛围。体育总局办公厅2021年5月28日,,,,体育总局暂停山地越野等赛事,0,0,1,2021-06-03 11:53,攀枝花身边事超话,['http://ww4.sinaimg.cn/large/b76c38a8gy1gr4xs6y1eaj20ra0c9n0e.jpg'],,
4643963568392921,KirGYzdnH,1561015262,我是西蒙周,【亡羊补牢：体育总局叫停多项新兴高危赛事】造成21人遇难的甘肃白银越野赛余波仍在震荡。6月2日，国家体育总局官网发布该局办公厅《关于暂停相关体育活动的通知》称，该起事件教训十分沉痛。从即日起，暂停山地越野、戈壁穿越、翼装飞行、超长距离跑等管理责任不清、规则不完善、安全防护标准不明确的新兴高危体育赛事活动。体育总局将对体育赛事活动进行全面梳理，加快完善管理制度，健全标准规范，全面加强对体育赛事活动安全的管理保障。O体育总局叫停多项新兴高危赛事将健全标准规范,,,,,1,1,2,2021-06-03 11:24,HUAWEI P40 Pro 5G,,,
4643962750765089,KirFF3d29,1999404300,宜昌发布,【体育总局：#暂停山地越野高危体育赛事#】#体育总局叫停高危体育赛事活动#6月2日，国家体育总局办公厅发布关于暂停相关体育活动的通知：5月22日，甘肃省白银市黄河石林百公里越野赛因局部天气突变发生公共安全事件，造成重大人员伤亡，教训十分沉痛。为切实保障人民群众身体健康和生命安全，从即日起，暂停山地越野、戈壁穿越、翼装飞行、超长距离跑等管理责任不清、规则不完善、安全防护标准不明确的新兴高危体育赛事活动。体育总局将对体育赛事活动进行全面梳理，加快完善管理制度，健全标准规范，全面加强对体育赛事活动安全的管理保障。各地要严格落实非必要不办赛要求，坚持底线思维，增强风险意识，强化属地管理责任，采取切实有效措施防范和化解风险。要围绕组织运营、服务保障、安全管理、应急救援、疫情防控、地质条件、气象因素等内容，对所有赛事活动开展全面风险排查，存在安全隐患的一律暂停，严防体育领域安全事件发生，为迎接建党100周年营造良好的环境和氛围。O网页链接,,,,"暂停山地越野高危体育赛事,体育总局叫停高危体育赛事活动",0,0,0,2021-06-03 11:21,微博 weibo.com,['http://ww2.sinaimg.cn/large/772c7d0cgy1gr4sjb19p1j20j60bz40c.jpg'],,
4643961551457017,KirDJ672h,1758961192,大项的天,造成21人遇难的甘肃白银越野赛余波仍在震荡。6月2日，国家体育总局官网发布该局办公厅《关于暂停相关体育活动的通知》称，该起事件教训十分沉痛。从即日起，暂停山地越野、戈壁穿越、翼装飞行、超长距离跑等管理责任不清、规则不完善、安全防护标准不明确的新兴高危体育赛事活动。体育总局将对体育赛事活动进行全面梳理，加快完善管理制度，健全标准规范，全面加强对体育赛事活动安全的管理保障。,,,,,1,0,3,2021-06-03 11:16,iPhone 12 Pro,['http://ww2.sinaimg.cn/large/68d79e28gy1gr4wq8zot3j20dc08wjtj.jpg'],,
4643960532502800,KirC5av5K,2043555452,雨城融媒,【即日起，暂停！】6月2日，国家体育总局办公厅发布了关于暂停相关体育活动的通知。各省、自治区、直辖市人民政府办公厅，新疆生产建设兵团办公厅：5月22日，甘肃省白银市黄河石林百公里越野赛因局部天气突变发生公共安全事件，造成重大人员伤亡，教训十分沉痛。为切实保障人民群众身体健康和生命安全，从即日起，暂停山地越野、戈壁穿越、翼装飞行、超长距离跑等管理责任不清、规则不完善、安全防护标准不明确的新兴高危体育赛事活动。体育总局将对体育赛事活动进行全面梳理，加快完善管理制度，健全标准规范，全面加强对体育赛事活动安全的管理保障。各地要严格落实非必要不办赛要求，坚持底线思维，增强风险意识，强化属地管理责任，采取切实有效措施防范和化解风险。要围绕组织运营、服务保障、安全管理、应急救援、疫情防控、地质条件、气象因素等内容，对所有赛事活动开展全面风险排查，存在安全隐患的一律暂停，严防体育领域安全事件发生，为迎接建党100周年营造良好的环境和氛围。体育总局办公厅2021年5月28日O网页链接,,,,,0,0,0,2021-06-03 11:12,微博 weibo.com,['http://ww3.sinaimg.cn/large/79ce2e7cgy1gr4wlzkm31j20ku09djsf.jpg'],,
4643960464868520,KirBYkqww,3150727772,清新雨城,【即日起，暂停！】6月2日，国家体育总局办公厅发布了关于暂停相关体育活动的通知。各省、自治区、直辖市人民政府办公厅，新疆生产建设兵团办公厅：5月22日，甘肃省白银市黄河石林百公里越野赛因局部天气突变发生公共安全事件，造成重大人员伤亡，教训十分沉痛。为切实保障人民群众身体健康和生命安全，从即日起，暂停山地越野、戈壁穿越、翼装飞行、超长距离跑等管理责任不清、规则不完善、安全防护标准不明确的新兴高危体育赛事活动。体育总局将对体育赛事活动进行全面梳理，加快完善管理制度，健全标准规范，全面加强对体育赛事活动安全的管理保障。各地要严格落实非必要不办赛要求，坚持底线思维，增强风险意识，强化属地管理责任，采取切实有效措施防范和化解风险。要围绕组织运营、服务保障、安全管理、应急救援、疫情防控、地质条件、气象因素等内容，对所有赛事活动开展全面风险排查，存在安全隐患的一律暂停，严防体育领域安全事件发生，为迎接建党100周年营造良好的环境和氛围。体育总局办公厅2021年5月28日O网页链接,,,,,0,0,0,2021-06-03 11:11,360安全浏览器,['http://ww4.sinaimg.cn/large/bbcc4a5cgy1gr4wlqe2tpj20ku09djsf.jpg'],,
4643957067223010,Kirwuuj2a,5558584537,颍上检察,【#体育总局暂停山地越野等赛事#】5月22日，甘肃省白银市黄河石林百公里越野赛因局部天气突变发生公共安全事件，造成重大人员伤亡，教训十分沉痛。为切实保障人民群众身体健康和生命安全，从即日起，暂停山地越野、戈壁穿越、翼装飞行、超长距离跑等管理责任不清、规则不完善、安全防护标准不明确的新兴高危体育赛事活动。体育总局将对体育赛事活动进行全面梳理，加快完善管理制度，健全标准规范，全面加强对体育赛事活动安全的管理保障。,,,,体育总局暂停山地越野等赛事,0,0,0,2021-06-03 10:58,搜狗高速浏览器,['http://ww3.sinaimg.cn/large/0064bfLjly1gr4w7pblsuj60j607wt9h02.jpg'],,
4643956929332783,KirwgD9SL,1712225142,西部商报入木三分,#甘肃山地马拉松事故21人遇难##兰州正在播#【国家体育总局：#山地越野等赛事被暂停#】国家体育总局：5月22日，甘肃白银市黄河石林百公里越野赛因局部天气突变发生公共安全事件，造成重大人员伤亡。为切实保障人民群众身体健康和生命安全，从即日起，暂停山地越野、戈壁穿越、翼装飞行、超长距离跑等管理责任不清、规则不完善、安全防护标准不明确的新兴高危体育赛事活动。#甘肃马拉松事故是天灾还是人祸#（@央视新闻@甘肃发布）,,,"央视新闻,甘肃发布","甘肃山地马拉松事故21人遇难,兰州正在播,山地越野等赛事被暂停,甘肃马拉松事故是天灾还是人祸",0,0,0,2021-06-03 10:57,Note 9 Pro 一亿像素,['http://ww4.sinaimg.cn/large/660e7b76ly1gr4w6v8qkbj20go0go77e.jpg'],,
4643956623410927,KirvMejkX,2355441347,今报洛阳,#体育总局暂停山地越野等新兴高危赛事#【体育总局：暂停山地越野等新兴高危体育赛事活动】体育总局办公厅关于暂停相关体育活动的通知：5月22日，甘肃省白银市黄河石林百公里越野赛因局部天气突变发生公共安全事件，造成重大人员伤亡，教训十分沉痛。为切实保障人民群众身体健康和生命安全，从即日起，暂停山地越野、戈壁穿越、翼装飞行、超长距离跑等管理责任不清、规则不完善、安全防护标准不明确的新兴高危体育赛事活动。体育总局将对体育赛事活动进行全面梳理，加快完善管理制度，健全标准规范，全面加强对体育赛事活动安全的管理保障。（来源：国家体育总局网站）,,,,体育总局暂停山地越野等新兴高危赛事,0,0,0,2021-06-03 10:56,微博 weibo.com,['http://ww3.sinaimg.cn/large/8c652ec3ly1gr4tnjz2h0j20j60brjt4.jpg'],,
4643956408976536,KirvqBFcQ,3413019662,安宁检察,【体育总局：暂停山地越野、戈壁穿越等新兴高危体育赛事活动】体育总局网站6月2日消息，体育总局办公厅印发通知：5月22日，甘肃省白银市黄河石林百公里越野赛因局部天气突变发生公共安全事件，造成重大人员伤亡，教训十分沉痛。为切实保障人民群众身体健康和生命安全，从即日起，暂停山地越野、戈壁穿越、翼装飞行、超长距离跑等管理责任不清、规则不完善、安全防护标准不明确的新兴高危体育赛事活动。体育总局将对体育赛事活动进行全面梳理，加快完善管理制度，健全标准规范，全面加强对体育赛事活动安全的管理保障。各地要严格落实非必要不办赛要求，坚持底线思维，增强风险意识，强化属地管理责任，采取切实有效措施防范和化解风险。要围绕组织运营、服务保障、安全管理、应急救援、疫情防控、地质条件、气象因素等内容，对所有赛事活动开展全面风险排查，存在安全隐患的一律暂停，严防体育领域安全事件发生，为迎接建党100周年营造良好的环境和氛围。,,,,,0,1,0,2021-06-03 10:55,HUAWEI P40 Pro 5G,['http://ww2.sinaimg.cn/large/cb6e8c0ely1gr4w4zdkl5j20tn0i0juk.jpg'],,
4643956271616321,Kirvd6MtH,1798920157,旅游榜中榜,【国家体育总局：#山地越野等赛事被暂停#】国家体育总局：5月22日，甘肃白银市黄河石林百公里越野赛因局部天气突变发生公共安全事件，造成重大人员伤亡。为切实保障人民群众身体健康和生命安全，从即日起，暂停山地越野、戈壁穿越、翼装飞行、超长距离跑等管理责任不清、规则不完善、安全防护标准不明确的新兴高危体育赛事活动。#体育总局暂停山地越野等赛事##马拉松和越野跑该不该全面叫停#,,,,"山地越野等赛事被暂停,体育总局暂停山地越野等赛事,马拉松和越野跑该不该全面叫停",0,0,0,2021-06-03 10:55,HUAWEI P40 Pro 5G,['http://ww2.sinaimg.cn/large/6b3957ddly1gr4w4f7oo9j20go0go0v2.jpg'],,
4643955201017325,Kirtu4gEt,3261451753,新浪大连旅游,#游你做主#5月22日，甘肃省白银市黄河石林百公里越野赛因局部天气突变发生公共安全事件，造成重大人员伤亡，教训十分沉痛。为切实保障人民群众身体健康和生命安全，从即日起，暂停山地越野、戈壁穿越、翼装飞行、超长距离跑等管理责任不清、规则不完善、安全防护标准不明确的新兴高危体育赛事活动。体育总局将对体育赛事活动进行全面梳理，加快完善管理制度，健全标准规范，全面加强对体育赛事活动安全的管理保障。,,,,游你做主,0,0,1,2021-06-03 10:51,微博 weibo.com,['http://ww2.sinaimg.cn/large/c265cde9ly1gr4qkawnttj20c8051q4l.jpg'],,
4643955087772820,KirtiwC44,7526082923,用户6108506759,#越野赛#5月22日，甘肃省白银市黄河石林百公里越野赛因极端天气发生公共安全事件，伤亡惨重，被称之为是“越野史上的黑暗时刻”，此后，多地暂停越野赛等相关赛事活动的举办，多地马拉松赛事也都延期举行。甘肃省越野跑事件发生的10天之后，6月2日，国家体育总局办公厅发布关于暂停相关体育活动。许多人不敢跑越野赛，它为何如此“可怕”？越野跑和普通的马拉松不同，它是一种户外耐力运动，它给参赛选手所带来的挑战是普通马拉松无法比拟的，它需要参赛者全身心的投入，这不仅仅是简单的向着终点跑去，更重要的是要面对户外赛道上可能出现的障碍和变化。因为是在户外，跑道千变万化，可能是山野沟壑，也可能是丛林溪涧，你可能会脚踩碎石，翻山越岭，趟过河水，甚至夏天还会遇到蛇，这都是越野赛过程中会遇到的情况。尽管在大多数越野跑在开赛前都会核查赛道和做好天气预判，但仍可能出现意外。天气，野生动物等等，这些突然的变化是没有办法预料的，所以对每一位参赛选手在面对突发事件时的应变处理能力要求也比较高。越野赛道高低不平，坡度较陡，上下坡是常有的事儿，赛道的这种多次迅速的变化会让选手的腿脚易受冲击和压力，可能会扭伤脚，扭到腰等等，像这样的情况在普通的马拉松赛道上就不会出现。越野赛带来的刺激和挑战是巨大的，但是危险因素也存在着，甘肃越野跑事件给全社会带来警醒作用，不管是从国家层面、社会层面还是个人层面，都要加深对马拉松、越野跑的认识，赛事准办机制也要完善，时刻谨记，安全第一。,,,,越野赛,0,1,0,2021-06-03 10:50,微博 weibo.com,"['http://ww4.sinaimg.cn/large/008dkFYfly1gr4vzec3ahj30g30b3jvn.jpg', 'http://ww1.sinaimg.cn/large/008dkFYfly1gr4vzebpkbj30em07zq3u.jpg', 'http://ww2.sinaimg.cn/large/008dkFYfly1gr4vzf4gnrj31730u0kjm.jpg']",,
4643953561048272,KirqQ4oHC,1777273207,互联网磊君说,体育总局发布暂停山地越野、戈壁穿越等体育活动的通知。体育总局办公厅发布通知，5月22日，甘肃省白银市黄河石林百公里越野赛因局部天气突变发生公共安全事件，造成重大人员伤亡。为切实保障人民群众身体健康和生命安全，从即日起，暂停山地越野、戈壁穿越、翼装飞行、超长距离跑等管理责任不清、规则不完善、安全防护标准不明确的新兴高危体育赛事活动。体育总局将对体育赛事活动进行全面梳理，加快完善管理制度，健全标准规范，全面加强对体育赛事活动安全的管理保障。,,,,,0,0,0,2021-06-03 10:44,微博 weibo.com,,,
4643952483636340,Kirp6ffYE,1797237782,美丽开远,【国家体育总局：#山地越野等赛事被暂停#】国家体育总局：5月22日，甘肃白银市黄河石林百公里越野赛因局部天气突变发生公共安全事件，造成重大人员伤亡。为切实保障人民群众身体健康和生命安全，从即日起，暂停山地越野、戈壁穿越、翼装飞行、超长距离跑等管理责任不清、规则不完善、安全防护标准不明确的新兴高危体育赛事活动。#体育总局暂停山地越野等赛事#,,,,"山地越野等赛事被暂停,体育总局暂停山地越野等赛事",0,0,0,2021-06-03 10:40,微博 weibo.com,['http://ww1.sinaimg.cn/large/6b1fac16gy1gr4voc5lbdj20j60860ty.jpg'],,
4643949916458304,KirkXr66c,2486181921,阳泉日报--阳泉新闻网,【#体育总局暂停山地越野等高危体育赛事#】据国家体育总局，5月22日，甘肃省白银市黄河石林百公里越野赛因局部天气突变发生公共安全事件，造成重大人员伤亡，教训十分沉痛。为切实保障人民群众身体健康和生命安全，从即日起，暂停山地越野、戈壁穿越、翼装飞行、超长距离跑等管理责任不清、规则不完善、安全防护标准不明确的新兴高危体育赛事活动。@人民日报,,,人民日报,体育总局暂停山地越野等高危体育赛事,0,0,0,2021-06-03 10:30,微博 weibo.com,['http://ww2.sinaimg.cn/large/94302021ly1gr4s7wj82ij20yn0lt7bg.jpg'],,
