id,bid,user_id,用户昵称,微博正文,头条文章url,发布位置,艾特用户,话题,转发数,评论数,点赞数,发布时间,发布工具,微博图片url,微博视频url,retweet_id
4643948910609320,Kirjl2yvK,3514287114,安徽省体育局,【体育总局办公厅关于暂停相关体育活动的通知】各省、自治区、直辖市人民政府办公厅，新疆生产建设兵团办公厅：　　5月22日，甘肃省白银市黄河石林百公里越野赛因局部天气突变发生公共安全事件，造成重大人员伤亡，教训十分沉痛。为切实保障人民群众身体健康和生命安全，从即日起，暂停山地越野、戈壁穿越、翼装飞行、超长距离跑等管理责任不清、规则不完善、安全防护标准不明确的新兴高危体育赛事活动。体育总局将对体育赛事活动进行全面梳理，加快完善管理制度，健全标准规范，全面加强对体育赛事活动安全的管理保障。各地要严格落实非必要不办赛要求，坚持底线思维，增强风险意识，强化属地管理责任，采取切实有效措施防范和化解风险。要围绕组织运营、服务保障、安全管理、应急救援、疫情防控、地质条件、气象因素等内容，对所有赛事活动开展全面风险排查，存在安全隐患的一律暂停，严防体育领域安全事件发生，为迎接建党100周年营造良好的环境和氛围。（来源：体育总局）,,,,,0,0,0,2021-06-03 10:26,微博 weibo.com,['http://ww4.sinaimg.cn/large/d177c40agy1gr4tbgrwwyj20rl0cu3z3.jpg'],,
4643948582668427,KiriObcb9,6187132230,美丽的和谐家园8868,《最新通知：暂停！》5月22日，甘肃省白银市黄河石林百公里越野赛因局部天气突变发生公共安全事件，造成重大人员伤亡，教训十分沉痛。O最新通知：暂停！,,,,,0,0,3,2021-06-03 10:24,百度App,['http://ww1.sinaimg.cn/large/006KIzJkly1gr4v8ml1sfj308o05smxd.jpg'],,
4643947928092998,KirhKxXme,7046706509,四川省崇州监狱,【#体育总局暂停山地越野等高危体育赛事#】据国家体育总局，5月22日，甘肃省白银市黄河石林百公里越野赛因局部天气突变发生公共安全事件，造成重大人员伤亡，教训十分沉痛。为切实保障人民群众身体健康和生命安全，从即日起，暂停山地越野、戈壁穿越、翼装飞行、超长距离跑等管理责任不清、规则不完善、安全防护标准不明确的新兴高危体育赛事活动。#张警官说狱事儿##张警官分享#@四川监狱@法治四川,,,"四川监狱,法治四川","体育总局暂停山地越野等高危体育赛事,张警官说狱事儿,张警官分享",0,0,0,2021-06-03 10:22,微博 weibo.com,,,
4643947772909190,KirhvccOq,6115560351,国是直通车,#洞见计划#【#越野赛安全因何失守#：强制性标准缺乏、办赛门槛低】甘肃白银市举办的黄河石林百公里越野赛，因21位跑者生命的逝去，使小众运动越野跑受到关注。中国正式的越野赛事起于2009年，某户外运动品牌举办了中国首个100公里耐力越野赛“北京国际越野跑挑战赛”，开启了国内越野赛的商业化之路。2014年是国内越野跑赛产业发展的重要转折点。为激活体育市场，国家体育总局于2014年底发文，除全国综合性运动会和少数特殊项目赛事外，包括商业性和群众性体育赛事在内的全国性体育赛事审批一律取消。有了政策鼓励，中国各地都在举办马拉松比赛，但中国越野跑仍处于发展初期，没有成熟的商业模式。（中新社）O越野赛安全因何失守：强制性标准缺乏、办赛门槛低,,,,"洞见计划,越野赛安全因何失守",1,0,0,2021-06-03 10:21,微博 weibo.com,,,
4643947551132358,Kirh94KzQ,1231520980,洲迹文旅暴军卿,【国家体育总局：暂停山地越野、戈壁穿越等新兴高危体育赛事活动】据国家体育总局6月2日消息，体育总局办公厅发布关于暂停相关体育活动的通知。5月22日，甘肃省白银市黄河石林百公里越野赛因局部天气突变发生公共安全事件，造成重大人员伤亡，教训十分沉痛。从即日起，暂停山地越野、戈壁穿越、翼装飞行、超长距离跑等管理责任不清、规则不完善、安全防护标准不明确的新兴高危体育赛事活动。体育总局将对体育赛事活动进行全面梳理，加快完善管理制度，健全标准规范，全面加强对体育赛事活动安全的管理保障。,,深圳·车公庙,,,0,0,0,2021-06-03 10:20,HUAWEI P40 5G,['http://ww4.sinaimg.cn/large/496784d4gy1gr4v3z82yyj20jg0c340z.jpg'],,
4643947295278038,KirgJm93E,2945890351,跑者世界RW,【国家体育总局：#山地越野等赛事被暂停#】#体育总局暂停山地越野等赛事#5月22日，甘肃白银市黄河石林百公里越野赛因局部天气突变发生公共安全事件，造成重大人员伤亡。为切实保障人民群众身体健康和生命安全，从即日起，暂停山地越野、戈壁穿越、翼装飞行、超长距离跑等管理责任不清、规则不完善、安全防护标准不明确的新兴高危体育赛事活动。,,,,"山地越野等赛事被暂停,体育总局暂停山地越野等赛事",1,2,1,2021-06-03 10:19,360安全浏览器,['http://ww3.sinaimg.cn/large/af96b82fgy1gr4v368xk8j20r40hmjw8.jpg'],,
4643946972842966,KirgdbVAi,5770151273,姬永锋,体育总局：暂停！体育总局网站6月2日消息，体育总局办公厅印发通知，暂停新兴高危体育赛事活动。体育总局办公厅关于暂停相关体育活动的通知各省、自治区、直辖市人民政府办公厅，新疆生产建设兵团办公厅：5月22日，甘肃省白银市黄河石林百公里越野赛因局部天气突变发生公共安全事件，造成重大人员伤亡，教训十分沉痛。为切实保障人民群众身体健康和生命安全，从即日起，暂停山地越野、戈壁穿越、翼装飞行、超长距离跑等管理责任不清、规则不完善、安全防护标准不明确的新兴高危体育赛事活动。体育总局将对体育赛事活动进行全面梳理，加快完善管理制度，健全标准规范，全面加强对体育赛事活动安全的管理保障。各地要严格落实非必要不办赛要求，坚持底线思维，增强风险意识，强化属地管理责任，采取切实有效措施防范和化解风险。要围绕组织运营、服务保障、安全管理、应急救援、疫情防控、地质条件、气象因素等内容，对所有赛事活动开展全面风险排查，存在安全隐患的一律暂停，严防体育领域安全事件发生，为迎接建党100周年营造良好的环境和氛围。体育总局办公厅2021年5月28日来源|体育总局官网,,,,,1,0,3,2021-06-03 10:18,360安全浏览器,,,
4643944907934873,KircSxidP,6427644421,杭州2022年亚运会,#体育总局暂停山地越野赛事#国家体育总局2日发布公告表示，5月22日，甘肃省白银市黄河石林百公里越野赛因局部天气突变发生公共安全事件，造成重大人员伤亡，教训十分沉痛。为切实保障人民群众身体健康和生命安全，从即日起，暂停山地越野、戈壁穿越、翼装飞行、超长距离跑等管理责任不清、规则不完善、安全防护标准不明确的新兴高危体育赛事活动。体育总局将对体育赛事活动进行全面梳理，加快完善管理制度，健全标准规范，全面加强对体育赛事活动安全的管理保障。（人民体育）,,,,体育总局暂停山地越野赛事,1,0,2,2021-06-03 10:10,iPhone客户端,['http://ww3.sinaimg.cn/large/0070ZJWdgy1gr4tt7w864j30ql0i0q78.jpg'],,
4643943952680736,KirblbfnG,1648374905,一露生,这里是白银越野赛全部21位逝者的故事O越野赛全部21位逝者的故事,,,,,0,2,0,2021-06-03 10:06,新浪体育,,,
4643943045923621,Kir9SoR0h,3610747074,lydia凡3610747074,民航联盟：全国暂停山地越野等新兴高危体育赛事活动民航联盟：从即日起全国暂停山地越野等管理责任不清、规则不完善、安全防护标准不明确的新兴高危体育赛事活动。国家体育总局昨天（2日）在官网解释，此举是为了切实保障人民群众身体健康和生命安全。受影响的体育赛事活动还包括戈壁穿越、翼装飞行和超长距离跑。体育总局说，上个月的甘肃省白银市黄河石林百公里越野赛因局部天气突变发生公共安全事件，造成重大人员伤亡，教训十分沉痛。体育总局将对体育赛事活动进行全面梳理，加快完善管理制度，健全标准规范，全面加强对体育赛事活动安全的管理保障。国家体育总局也强调，各地要严格落实非必要不办赛要求，对所有赛事活动开展全面风险排查，存在安全隐患的一律暂停，严防体育领域安全事件发生。为进一步规范路跑赛事安全管理工作，体育总局办公厅要求落实好“安全风险防控方案、应急处理方案、疫情防控方案和赛事组织方案”。具备四个方案的路跑赛事须向赛事所属省级主管部门进行赛事陈述汇报获批准后，方可举办。不符合要求的赛事，须暂停举办。,,,,,0,0,0,2021-06-03 10:02,微博 weibo.com,['http://ww3.sinaimg.cn/large/d737a0c2ly1gr4ulnd8r2j20z90ni4qq.jpg'],,
4643940433134937,Kir5Fd9xv,3210953330,丽水检察,【体育总局：#暂停山地越野高危体育赛事#】#体育总局叫停高危体育赛事活动#6月2日，国家体育总局办公厅发布关于暂停相关体育活动的通知：5月22日，甘肃省白银市黄河石林百公里越野赛因局部天气突变发生公共安全事件，造成重大人员伤亡，教训十分沉痛。为切实保障人民群众身体健康和生命安全，从即日起，暂停山地越野、戈壁穿越、翼装飞行、超长距离跑等管理责任不清、规则不完善、安全防护标准不明确的新兴高危体育赛事活动。体育总局将对体育赛事活动进行全面梳理，加快完善管理制度，健全标准规范，全面加强对体育赛事活动安全的管理保障。各地要严格落实非必要不办赛要求，坚持底线思维，增强风险意识，强化属地管理责任，采取切实有效措施防范和化解风险。要围绕组织运营、服务保障、安全管理、应急救援、疫情防控、地质条件、气象因素等内容，对所有赛事活动开展全面风险排查，存在安全隐患的一律暂停，严防体育领域安全事件发生，为迎接建党100周年营造良好的环境和氛围。O网页链接,,,,"暂停山地越野高危体育赛事,体育总局叫停高危体育赛事活动",0,0,0,2021-06-03 09:52,新版微博 weibo.com,['http://ww4.sinaimg.cn/large/bf634272ly1gr4uauubg1j20c107i76t.jpg'],,
4643938882029750,Kir3a8w1U,1702806611,峨眉微博,【国家体育总局：#山地越野等赛事被暂停#】国家体育总局：5月22日，甘肃白银市黄河石林百公里越野赛因局部天气突变发生公共安全事件，造成重大人员伤亡。为切实保障人民群众身体健康和生命安全，从即日起，暂停山地越野、戈壁穿越、翼装飞行、超长距离跑等管理责任不清、规则不完善、安全防护标准不明确的新兴高危体育赛事活动。,,,,山地越野等赛事被暂停,0,0,0,2021-06-03 09:46,搜狗高速浏览器,,,
4643938751217945,Kir2X56Qh,5189408270,上城检察,#体育总局暂停高危体育赛事活动#【体育总局：#即日起暂停山地越野等新兴高危体育赛事活动#】6月2日，国家体育总局官网发布关于暂停相关体育活动的通知。通知指出，5月22日，甘肃省白银市黄河石林百公里越野赛因局部天气突变发生公共安全事件，造成重大人员伤亡，教训十分沉痛。为切实保障人民群众身体健康和生命安全，从即日起，暂停山地越野、戈壁穿越、翼装飞行、超长距离跑等管理责任不清、规则不完善、安全防护标准不明确的新兴高危体育赛事活动。O网页链接,,,,"体育总局暂停高危体育赛事活动,即日起暂停山地越野等新兴高危体育赛事活动",0,2,0,2021-06-03 09:45,微博 weibo.com,['http://ww2.sinaimg.cn/large/005Fce9oly1gr4u3yew90j30j60bzwfq.jpg'],,
4643938340700801,Kir2i2Wjf,5211109597,体育大生意,甘肃白银百公里越野赛公共安全事件在中国体育界引发的反思和余震仍在持续。6月2日，国家体育总局官网连续刊出《体育总局办公厅关于暂停相关体育活动的通知》、《体育总局办公厅关于加强路跑赛事安全管理工作的通知》两则通知。前一则《通知》直接点名要求暂停山地越野、戈壁穿越、翼装飞行、超长距离跑这四类高危体育赛事运动，后一则《通知》要求包括5公里跑在内的常规路跑赛事落实四大预案。O体育总局暂停四类新兴高危赛事，释放三大信号助行业稳步重启,,,,,0,0,0,2021-06-03 09:44,微博 weibo.com,,,
4643938068072556,Kir1QxS2w,5137474769,余杭检察,#体育总局暂停高危体育赛事活动#【体育总局：#即日起暂停山地越野等新兴高危体育赛事活动#】6月2日，国家体育总局官网发布关于暂停相关体育活动的通知。通知指出，5月22日，甘肃省白银市黄河石林百公里越野赛因局部天气突变发生公共安全事件，造成重大人员伤亡，教训十分沉痛。为切实保障人民群众身体健康和生命安全，从即日起，暂停山地越野、戈壁穿越、翼装飞行、超长距离跑等管理责任不清、规则不完善、安全防护标准不明确的新兴高危体育赛事活动。O网页链接,,,,"体育总局暂停高危体育赛事活动,即日起暂停山地越野等新兴高危体育赛事活动",0,0,0,2021-06-03 09:42,微博 weibo.com,['http://ww3.sinaimg.cn/large/005BGjShly1gr4u15244bj30j60bzgtz.jpg'],,
4643937882737999,Kir1ybuhh,5490667576,济宁任城检察,【#体育总局暂停山地越野等高危体育赛事#】据国家体育总局，5月22日，甘肃省白银市黄河石林百公里越野赛因局部天气突变发生公共安全事件，造成重大人员伤亡，教训十分沉痛。为切实保障人民群众身体健康和生命安全，从即日起，暂停山地越野、戈壁穿越、翼装飞行、超长距离跑等管理责任不清、规则不完善、安全防护标准不明确的新兴高危体育赛事活动。,,,,体育总局暂停山地越野等高危体育赛事,8,0,6,2021-06-03 09:42,360安全浏览器,['http://ww3.sinaimg.cn/large/005ZAhssly1gr4u0da8ylj30j60c2thi.jpg'],,
4643936734545254,KiqZHj4qy,5065571660,保定检察,【体育总局：暂停山地越野、戈壁穿越等新兴高危体育赛事活动】体育总局网站6月2日消息，体育总局办公厅印发通知：5月22日，甘肃省白银市黄河石林百公里越野赛因局部天气突变发生公共安全事件，造成重大人员伤亡，教训十分沉痛。为切实保障人民群众身体健康和生命安全，从即日起，暂停山地越野、戈壁穿越、翼装飞行、超长距离跑等管理责任不清、规则不完善、安全防护标准不明确的新兴高危体育赛事活动。体育总局将对体育赛事活动进行全面梳理，加快完善管理制度，健全标准规范，全面加强对体育赛事活动安全的管理保障。各地要严格落实非必要不办赛要求，坚持底线思维，增强风险意识，强化属地管理责任，采取切实有效措施防范和化解风险。要围绕组织运营、服务保障、安全管理、应急救援、疫情防控、地质条件、气象因素等内容，对所有赛事活动开展全面风险排查，存在安全隐患的一律暂停，严防体育领域安全事件发生，为迎接建党100周年营造良好的环境和氛围。@检察日报,,,检察日报,,14,12,9,2021-06-03 09:37,360安全浏览器,['http://ww1.sinaimg.cn/large/005wOCAIly1gr4tvex4dfj30j60cf46d.jpg'],,
4643933856993399,KiqV3tliL,6573929973,易看达州,【#体育总局暂停山地越野等高危体育赛事#】据国家体育总局，5月22日，甘肃省白银市黄河石林百公里越野赛因局部天气突变发生公共安全事件，造成重大人员伤亡，教训十分沉痛。为切实保障人民群众身体健康和生命安全，从即日起，暂停山地越野、戈壁穿越、翼装飞行、超长距离跑等管理责任不清、规则不完善、安全防护标准不明确的新兴高危体育赛事活动。(人民日报),,,,体育总局暂停山地越野等高危体育赛事,0,0,0,2021-06-03 09:26,搜狗高速浏览器,['http://ww1.sinaimg.cn/large/007aTxuBgy1gr4tjqscnwj30j60c240p.jpg'],,
4643932912749765,KiqTxbxl3,6083245339,贵溪发布,【国家体育总局：#山地越野等赛事被暂停#】国家体育总局：5月22日，甘肃白银市黄河石林百公里越野赛因局部天气突变发生公共安全事件，造成重大人员伤亡。为切实保障人民群众身体健康和生命安全，从即日起，暂停山地越野、戈壁穿越、翼装飞行、超长距离跑等管理责任不清、规则不完善、安全防护标准不明确的新兴高危体育赛事活动。#体育总局暂停山地越野等赛事#,,,,"山地越野等赛事被暂停,体育总局暂停山地越野等赛事",0,0,0,2021-06-03 09:22,搜狗高速浏览器,,,
4643932603155671,KiqT2deVV,7506173308,大姚融媒,【国家体育总局：#山地越野等赛事被暂停#】国家体育总局：5月22日，甘肃白银市黄河石林百公里越野赛因局部天气突变发生公共安全事件，造成重大人员伤亡。为切实保障人民群众身体健康和生命安全，从即日起，暂停山地越野、戈壁穿越、翼装飞行、超长距离跑等管理责任不清、规则不完善、安全防护标准不明确的新兴高危体育赛事活动。,,,,山地越野等赛事被暂停,0,0,0,2021-06-03 09:21,新版微博 weibo.com,['http://ww1.sinaimg.cn/large/008bZ8zqgy1gr4tej1lrvj30go0go77e.jpg'],,
4643932330263265,KiqSB16ud,1655068234,东方体育日报,【#体育总局暂停山地越野赛事#】国家体育总局2日发布公告表示，5月22日，甘肃省白银市黄河石林百公里越野赛因局部天气突变发生公共安全事件，造成重大人员伤亡，教训十分沉痛。为切实保障人民群众身体健康和生命安全，从即日起，暂停山地越野、戈壁穿越、翼装飞行、超长距离跑等管理责任不清、规则不完善、安全防护标准不明确的新兴高危体育赛事活动。,,,,体育总局暂停山地越野赛事,0,2,3,2021-06-03 09:20,360安全浏览器,['http://ww3.sinaimg.cn/large/62a6564agy1gr4tde4o4jj20qg0fowrm.jpg'],,
4643932166947337,KiqSkt9jP,1289948791,管理咨询尹佳扬,管中窥豹，一不小心，我看到了很多普通人的真实生活状态，更加可悲的是，他们有超人的意志力和坚持，但生活依然很穷困……一个好的社会应该给与愿意努力的人努力创造美好生活的机会……『这里是白银越野赛全部21位逝者的故事_腾讯网』O这里是白银越野赛全部21位逝者的故事,,,,,0,0,0,2021-06-03 09:19,小米8周年旗舰手机,,,
4643931188888411,KiqQKBiht,3888223184,达州发布,【#体育总局暂停山地越野等高危体育赛事#】据国家体育总局，5月22日，甘肃省白银市黄河石林百公里越野赛因局部天气突变发生公共安全事件，造成重大人员伤亡，教训十分沉痛。为切实保障人民群众身体健康和生命安全，从即日起，暂停山地越野、戈壁穿越、翼装飞行、超长距离跑等管理责任不清、规则不完善、安全防护标准不明确的新兴高危体育赛事活动。(人民日报),,,,体育总局暂停山地越野等高危体育赛事,0,0,2,2021-06-03 09:15,360安全浏览器,['http://ww4.sinaimg.cn/large/e7c193d0gy1gr4t8jo6juj20j60c276c.jpg'],,
4643930870645514,KiqQf2HVw,2945394960,抚州资溪发布,【#体育总局暂停山地越野等高危体育赛事#】据国家体育总局，5月22日，甘肃省白银市黄河石林百公里越野赛因局部天气突变发生公共安全事件，造成重大人员伤亡，教训十分沉痛。为切实保障人民群众身体健康和生命安全，从即日起，暂停山地越野、戈壁穿越、翼装飞行、超长距离跑等管理责任不清、规则不完善、安全防护标准不明确的新兴高危体育赛事活动。,,,,体育总局暂停山地越野等高危体育赛事,0,0,0,2021-06-03 09:14,微博 weibo.com,['http://ww4.sinaimg.cn/large/af8f2910gy1gr4t7dqcdmj20j60c276c.jpg'],,
4643930761330954,KiqQ45Af0,3846489597,昆明市西山区发布,【国家体育总局：#山地越野等赛事被暂停#】国家体育总局：5月22日，甘肃白银市黄河石林百公里越野赛因局部天气突变发生公共安全事件，造成重大人员伤亡。为切实保障人民群众身体健康和生命安全，从即日起，暂停山地越野、戈壁穿越、翼装飞行、超长距离跑等管理责任不清、规则不完善、安全防护标准不明确的新兴高危体育赛事活动。（@央视网快看）L央视网快看的微博视频,,,央视网快看,山地越野等赛事被暂停,0,0,0,2021-06-03 09:13,Android,,"http://locallimit.us.sinaimg.cn/dneZqfZKlx07N9233u9a010412004gYS0E010.mp4?label=mp4_ld&template=640x360.25.0&trans_finger=6006a648d0db83b7d9951b3cee381a9c&ori=0&ps=1BVp4ysnknHVZu&Expires=1624595141&ssig=nj8pFpyRGE&KID=unistore,video",
4643929700698449,KiqOm2VHj,2255235787,殳几,张凤莲因为生二胎失去甘肃省人民医院的工作，以卖菜为生，为了获得奖金参加马拉松比赛，在白银越野赛中丧生，这两件事居然能连起来,,,,,0,0,0,2021-06-03 09:09,新版微博 weibo.com,,,
4643929050580863,KiqNj2r6L,2230851664,安徽经济广播,【体育总局：暂停山地越野、戈壁穿越、翼装飞行、超长距离跑等赛事】6月2日，体育总局办公厅发布关于暂停相关体育活动的通知：各省、自治区、直辖市人民政府办公厅，新疆生产建设兵团办公厅：5月22日，甘肃省白银市黄河石林百公里越野赛因局部天气突变发生公共安全事件，造成重大人员伤亡，教训十分沉痛。为切实保障人民群众身体健康和生命安全，从即日起，暂停山地越野、戈壁穿越、翼装飞行、超长距离跑等管理责任不清、规则不完善、安全防护标准不明确的新兴高危体育赛事活动。体育总局将对体育赛事活动进行全面梳理，加快完善管理制度，健全标准规范，全面加强对体育赛事活动安全的管理保障。各地要严格落实非必要不办赛要求，坚持底线思维，增强风险意识，强化属地管理责任，采取切实有效措施防范和化解风险。要围绕组织运营、服务保障、安全管理、应急救援、疫情防控、地质条件、气象因素等内容，对所有赛事活动开展全面风险排查，存在安全隐患的一律暂停，严防体育领域安全事件发生，为迎接建党100周年营造良好的环境和氛围。体育总局办公厅2021年5月28日,,,,,0,0,0,2021-06-03 09:07,新版微博 weibo.com,,,
4643928160338518,KiqLS1q3Y,1031812221,窦爷,体育总局：暂停山地越野、翼装飞行等新兴高危体育赛事。的确，甘肃省白银市黄河石林百公里越野赛的教训深刻啊。组织体育比赛，现如今看来，安全保障那也是无比重要的一个环节。白银市的惨痛教训就是，如此重大的体育赛事，因为忽视了安全保障，最终酿成重大的悲剧事件。此时国家体育总局叫停各类高危体育赛事，那也正是基于安全保障的考虑吧……,,,,,0,0,0,2021-06-03 09:03,分享按钮,,,
4643927837641081,KiqLlw3Nf,5880670495,小曹正能量,不要看不起任何人，有时候救你命的，就是那些不起眼的普通人！甘肃白银市景泰县常生村村民，放羊大叔朱克铭，当时不顾寒风冰雹，救助参加马拉松越野赛，遭遇低温失能的选手六人，拯救了六个家庭，功德无量，真正感动中国的中国好人！,,,,,0,0,0,2021-06-03 09:02,即刻笔记,['http://ww4.sinaimg.cn/large/7080ab5bly1gqyaijtxycj20eh0lxdjm.jpg'],,
4643924851823006,KiqGx7Efk,5489648305,中商微视点,《最新通知：暂停！》5月22日，甘肃省白银市黄河石林百公里越野赛因局部天气突变发生公共安全事件，造成重大人员伤亡，教训十分沉痛。O最新通知：暂停！,,,,,0,0,2,2021-06-03 08:50,百度App,['http://ww4.sinaimg.cn/large/005Zw0iBly1gr4siioskoj308o05s74g.jpg'],,
4643923622364290,KiqEy9V3I,1918073712,中国探险协会官方微博,【#体育总局暂停山地越野等赛事#，称甘肃白银越野赛事件教训沉痛】体育总局发布通知称，从即日起，暂停山地越野、戈壁穿越、翼装飞行、超长距离跑等管理责任不清、规则不完善、安全防护标准不明确的新兴高危体育赛事活动。通知中还提到，将对所有赛事活动开展全面风险排查。,,,,体育总局暂停山地越野等赛事,0,0,1,2021-06-03 08:45,微博 weibo.com,['http://ww2.sinaimg.cn/large/72537b70ly1gr4sdar33vj219i0u07ru.jpg'],,
